post_id,user_id,user_name,title
21,3,Clementine Bauch,asperiores ea ipsam voluptatibus modi minima quia sint
22,3,Clementine Bauch,dolor sint quo a velit explicabo quia nam
23,3,Clementine Bauch,maxime id vitae nihil numquam
24,3,Clementine Bauch,autem hic labore sunt dolores incidunt
25,3,Clementine Bauch,rem alias distinctio quo quis
26,3,Clementine Bauch,est et quae odit qui non
27,3,Clementine Bauch,quasi id et eos tenetur aut quo autem
28,3,Clementine Bauch,delectus ullam et corporis nulla voluptas sequi
29,3,Clementine Bauch,iusto eius quod necessitatibus culpa ea
30,3,Clementine Bauch,a quo magni similique perferendis
